id,name,company_id,contact_ids,type,stage,description,amount,created_at,updated_at,start_at,sales_id,index,nb_notes
21,Sed quia quos,46,43;66;90,Website design,in-negociation,"Voluptatem dignissimos aspernatur exercitationem totam amet nihil molestiae perspiciatis dicta. Non in fugiat vitae temporibus modi ut suscipit quasi. Qui voluptas occaecati neque doloremque dolorem hic provident. Blanditiis consequatur est. Voluptatem voluptatibus voluptas inventore. Nesciunt non repellendus.
 Similique occaecati vel dolores quaerat. Nostrum provident id excepturi qui voluptatibus et voluptatibus asperiores. Qui corporis est facere repellat ut possimus ipsa. Accusantium corporis alias quibusdam nemo aliquam tempore non.",40800,2023-09-18T03:50:18.924Z,2024-02-15T15:57:45.445Z,2024-05-31T09:42:46.775Z,5,7,7
30,Est nemo libero,34,42;77,UI Design,delayed,"Nisi libero reiciendis sapiente et nihil. Officiis illo voluptatibus minus nostrum et at perspiciatis. Enim iste quis maxime enim nisi fugit quasi quia. Consectetur quod cum nihil velit reprehenderit in veniam fuga. Qui dolor labore vel libero ea repellendus sint. Dolorem et alias earum.
 Error quam deserunt quo fugiat. Perspiciatis perspiciatis alias reiciendis nam quo dignissimos delectus dignissimos. Earum hic possimus doloremque dolor.",6400,2023-11-22T11:16:45.579Z,2024-01-21T16:42:12.353Z,2024-03-22T14:01:00.678Z,8,7,4
44,Aut vitae magnam,30,335;367,Copywriting,opportunity,"Aut quos quia occaecati sequi ratione illum omnis. Aut saepe consequatur corrupti consequatur. Libero quasi esse ducimus fugiat aut omnis consectetur in dolorem. Ut quasi aut. Exercitationem fuga ad dicta neque.
 Delectus nulla quia. Praesentium et autem nihil rerum nulla illo ut voluptas. Minus recusandae et officiis. Ut quos sit corporis ut quia exercitationem. Placeat dolorem iste consequuntur animi rerum pariatur rerum sit. Dignissimos ea delectus labore et veniam.",4400,2023-11-29T13:08:26.578Z,2023-12-29T05:52:09.443Z,2024-06-21T17:42:20.066Z,5,7,4
48,Non sint tempora,25,47;82;196,Website design,proposal-sent,"Et excepturi vitae provident dolor illo nihil fuga dolores totam. Voluptas et tempora dolorem ut. Aut architecto velit qui perspiciatis alias. Nostrum eaque itaque. Expedita perspiciatis tenetur vel eum id voluptas omnis.
 Voluptates doloremque voluptas. Voluptatem perferendis et deleniti quidem quasi nam. Alias velit consequatur assumenda. Sit laudantium et eaque. At autem sed aut voluptatem exercitationem earum porro et atque.
 Ut dolorem enim autem enim dolor. Dolorum explicabo deserunt. Non facere harum iste doloribus in eligendi qui. Dolores quae reprehenderit.
 Sint doloremque accusamus ullam voluptate excepturi eum et vero enim. Ducimus error iusto a. Quis consequatur aperiam enim tempora dolores. Nulla necessitatibus aut laudantium unde optio. Consequatur aut velit. Velit minus consequuntur consequatur non molestiae cumque.",48400,2024-01-14T14:09:49.881Z,2024-02-16T09:02:04.639Z,2024-07-23T02:49:09.976Z,6,7,3
49,Est quia quam,25,47;82;196,Other,won,Harum repudiandae adipisci tenetur illum ipsa at architecto. Iusto suscipit error voluptas id eum praesentium iusto. Ipsum quis dolores fuga facilis. Quasi perferendis rerum quidem at molestias.,17800,2024-01-28T14:14:15.484Z,2024-02-03T01:05:00.415Z,2024-05-24T14:17:09.930Z,6,7,7
27,Rerum explicabo voluptas,12,130;244;248,Website design,in-negociation,"Enim corrupti non expedita dolore. Quia dolorum consectetur nisi cupiditate quia eum tenetur. Adipisci et praesentium natus et.
 Sunt voluptatem dolor et. Occaecati enim explicabo numquam ut minus possimus. Quia omnis nam sit voluptatem iure. Fugit nesciunt ut aliquam voluptas ut consequatur maxime at cupiditate. Repellendus aut eos laboriosam. Consequatur quidem adipisci non.",71400,2023-06-18T12:56:19.457Z,2023-07-08T18:44:39.929Z,2024-06-10T03:34:17.792Z,1,8,7
31,Voluptas dolorem labore,32,423,Other,delayed,"Inventore eos laudantium numquam sunt quo aut rerum. Error dignissimos eos saepe sed hic rem. Vero inventore reprehenderit libero iusto dolores laboriosam quasi maiores. Laborum sunt enim itaque reprehenderit qui. Sunt sint recusandae soluta sed dolor.
 Quia sit numquam possimus quisquam quisquam veritatis. Quia id atque non officia id nihil harum qui molestiae. Enim nisi nihil reiciendis dolorem at ut adipisci harum a. Eveniet itaque quod ab non ad sit. Sequi consectetur aliquid similique qui harum at.
 Cumque voluptatem quae facere. Adipisci occaecati error laboriosam qui aspernatur autem nesciunt aut rerum. Ut aperiam quas expedita distinctio odit velit adipisci. Vero sequi ipsam sint et rerum nostrum.",22500,2023-07-17T01:52:44.312Z,2023-09-23T07:54:02.904Z,2024-05-25T15:23:06.146Z,0,8,13
33,Nulla ullam laudantium,42,296,UI Design,in-negociation,"Sapiente enim officia et facere facilis. Deserunt repudiandae reiciendis asperiores maxime fugiat. Sapiente inventore fugiat corrupti velit explicabo ullam in neque labore. Ab fugiat laboriosam illum veniam. Et corporis expedita expedita alias. Eum voluptatem quia possimus quos nulla molestias illo voluptatem.
 Incidunt cupiditate cumque a vel incidunt earum exercitationem. Praesentium quasi suscipit. Sint ut exercitationem ut eaque blanditiis modi voluptatem. Omnis repudiandae voluptatem.",2800,2021-02-14T07:56:12.888Z,2023-12-10T07:46:40.366Z,2024-04-04T08:12:28.678Z,0,9,3
41,Eum voluptas qui,46,43;138,Website design,delayed,Voluptatem et nemo ea earum enim ut fuga sit. Molestiae nostrum enim doloribus facere et itaque magnam libero. Pariatur dolores velit repellat commodi ipsam omnis. Ut officia quaerat aut repellendus debitis reiciendis vel qui et. Sit eum et reprehenderit omnis magnam aut ut voluptatem.,67700,2023-12-28T03:23:18.929Z,2024-01-29T19:15:21.571Z,2024-08-11T20:41:17.911Z,5,9,4
45,Id eveniet accusantium,11,157;368,Copywriting,delayed,Repellat id velit nihil necessitatibus aliquam omnis. Ullam ex est et aperiam. Non et soluta quaerat illum dolores doloremque aut odio. Fugit voluptate consequatur officiis non error sed velit quaerat. Id dolorem recusandae eaque sed minus eum.,48900,2024-02-17T02:02:19.593Z,2024-02-17T09:12:29.899Z,2024-08-13T10:04:21.891Z,4,10,7
47,Et architecto vitae,0,51;205;311,Copywriting,in-negociation,"Quis officiis ipsam in aliquam doloribus laborum assumenda amet. Modi atque perferendis ut eius nulla ratione recusandae. Iure minima cum quia dolorem occaecati non neque officia.
 Sed omnis vero. Culpa necessitatibus aut voluptate quibusdam minima vero quae. Ea iure doloremque ut. Quis ut quod alias voluptates nobis voluptatem sed sint. Vero laboriosam placeat animi corrupti. Nostrum vero non dolorum.",50100,2023-12-03T13:00:30.048Z,2024-02-15T11:13:47.619Z,2024-06-02T14:16:05.989Z,0,10,9