id,name,company_id,contact_ids,type,stage,description,amount,created_at,updated_at,start_at,sales_id,index,nb_notes
0,Aspernatur nam quaerat,37,416;448,UI Design,opportunity,"Ut est illum est aut. Sed aperiam praesentium ipsa quibusdam quia facilis at. Non sapiente molestiae veritatis ad cum.
 Aut voluptates est. Hic nam autem enim animi. Aut earum veritatis eum et accusamus. Accusamus deleniti quam porro dicta ut et vitae nulla. Sint vero et omnis est necessitatibus.
 Necessitatibus omnis id dolorum nobis numquam. Nemo animi facere. Delectus minus corrupti optio perspiciatis. Asperiores unde aut consectetur. Dignissimos vel in adipisci est quis. Ratione totam voluptas officia rerum est quae quibusdam voluptas qui.
 Aut quis ut. Consequatur quas sit perspiciatis sit porro deserunt. Alias accusantium tenetur repellat. Necessitatibus et eligendi aliquam at.",29500,2024-02-05T22:51:28.197Z,2024-02-11T11:53:40.473Z,2024-08-08T20:02:25.817Z,3,0,6
1,Veritatis reprehenderit non,23,117;137;269,Other,won,"Tempore quia expedita voluptatem dolor consequatur. Earum voluptate ut maiores autem mollitia eligendi. Ut fugit eius aperiam. Aut tenetur quo omnis officiis quas et officiis qui officiis.
 Numquam quis delectus ut mollitia fugit eligendi suscipit. Minima voluptate in quia. Voluptas voluptatem ipsam amet reprehenderit debitis id voluptatem minima. Beatae voluptas doloremque iure voluptatum velit eligendi aut reprehenderit cumque. Itaque sed sint.",15900,2023-10-11T04:54:18.272Z,2024-01-10T16:31:25.930Z,2024-06-18T06:53:59.626Z,3,0,6
2,Ut aut aut,11,292;368,Print project,delayed,"Inventore dolores quas voluptatem tempore nisi numquam. Cumque vel non dolorem hic dignissimos quidem et. Qui quae aut voluptates soluta eos dolore odit. Consequatur soluta ut accusamus maiores veniam enim possimus doloremque. Dolor velit nam at aliquid vel et. Quae ipsam molestias voluptatum quia eum porro esse assumenda.
 Consequatur et ut in ut quaerat similique nulla ducimus velit. Et quo rerum ea veniam corrupti deleniti. Ipsum ut alias omnis autem.",7400,2024-02-10T19:27:23.689Z,2024-02-16T16:10:05.908Z,2024-05-22T02:44:06.509Z,4,0,10
3,Dolor et natus,17,32,Website design,proposal-sent,"Voluptates eaque non beatae. Perspiciatis recusandae placeat qui nostrum est. Autem excepturi deserunt soluta dolores dolore quae deleniti. Aliquam quo sunt voluptatem harum sint sit eos. Rem porro est delectus assumenda nihil. Eum rerum aut libero illo id velit magni magnam.
 Quasi sequi unde maxime deleniti dolores temporibus. Quia et velit et provident quis optio tempore ab. Pariatur magnam tempora ipsum voluptatem cupiditate incidunt. Nobis inventore ex corporis vel id tenetur vitae voluptatem. Sed at et molestiae voluptates odit libero. Officiis dolor fuga maxime cumque quod sit velit et.",92200,2024-01-08T12:27:31.156Z,2024-02-08T01:56:04.738Z,2024-07-14T01:30:18.641Z,0,0,6
6,Voluptatem itaque adipisci,26,454,Copywriting,in-negociation,"Recusandae quibusdam libero enim qui aut ea officiis molestiae. Adipisci et ipsam. Eum explicabo consequatur dolorum ab. Sed vitae adipisci excepturi eum et eius ducimus ducimus quia. Iste numquam asperiores nostrum itaque culpa et sed itaque sint.
 Et harum est soluta ullam ullam corrupti enim voluptate blanditiis. Et est ipsa repellendus accusantium ipsa saepe et et. Facilis adipisci quo itaque molestiae.
 Perspiciatis ipsum ipsa. Alias voluptas similique perferendis eum est dolores doloremque. Quis delectus et voluptas voluptatibus. Numquam fuga eum et pariatur aut consectetur sapiente. Accusantium soluta placeat placeat voluptatibus ut modi neque.
 Fugiat fugit numquam exercitationem. At voluptatibus sint veritatis est doloremque consequuntur delectus. Eum ut id exercitationem voluptas. Est nulla numquam sint inventore id esse neque.",28000,2023-10-26T06:42:55.146Z,2023-12-05T22:43:42.596Z,2024-05-01T15:57:28.369Z,4,0,5
15,Explicabo voluptatibus repellendus,0,303;362,UI Design,lost,"Itaque sunt quis et est soluta. Nobis voluptate delectus. Molestiae eum facere ratione sed sapiente nemo consectetur quaerat a. Optio quia ut corporis ut unde eveniet doloremque corporis ducimus. Maxime reprehenderit et numquam cumque occaecati voluptate necessitatibus nobis.
 Nulla sed qui porro quia. Repudiandae qui velit. Iste aut molestiae aut consequatur.
 Illum aperiam impedit illo enim nemo possimus. Eveniet officia quis ipsa odio animi maxime totam. Explicabo ea molestias sunt qui porro vel eos. Itaque rem ut.",95500,2024-02-08T05:49:00.327Z,2024-02-10T05:51:17.794Z,2024-07-06T17:10:03.233Z,0,0,6
4,Natus ducimus eos,13,7,Website design,delayed,"Distinctio nemo perferendis natus quas voluptates ut est. Sunt aut ducimus hic ipsa quos neque. Et harum qui esse ut voluptatem. Ratione enim pariatur. Facilis id dolores laboriosam non provident sint.
 Sit dolor expedita quia omnis magnam sunt. Debitis natus fugiat est est. Error sed perspiciatis magnam consequatur ut.",39700,2023-09-02T16:57:05.066Z,2024-02-13T15:35:57.608Z,2024-06-30T18:05:19.436Z,8,1,6
7,Et omnis dolor,49,9,Other,in-negociation,"Et nesciunt quasi sit possimus. Omnis suscipit sit modi veritatis. Voluptas veritatis rerum aperiam nobis id maxime neque. Et asperiores unde perspiciatis non cum et quisquam aperiam id. Numquam qui molestias nostrum omnis.
 Eveniet sunt accusamus culpa consequatur ipsa neque est. Illo culpa et similique. Pariatur dolorem nostrum saepe aut laborum corporis vitae. Exercitationem quia at doloremque voluptatum error alias. Repudiandae sed quasi error deleniti saepe dolor quis.
 Quia et et ipsa voluptatum perferendis dolores. Eos ut vel quod provident qui quis hic est. Qui dicta quaerat blanditiis suscipit quod quas. Consequatur ab ullam et cumque totam officiis enim in omnis.",31400,2024-01-28T06:25:10.753Z,2024-02-16T14:46:17.176Z,2024-04-26T17:06:00.464Z,0,1,3
8,Alias distinctio similique,19,396,Print project,proposal-sent,Asperiores modi porro dignissimos laboriosam. A libero laborum. Quod sequi officia labore.,99400,2023-09-17T11:42:57.777Z,2024-02-11T15:21:59.959Z,2024-06-21T05:18:59.685Z,8,1,6
11,Labore ratione corrupti,12,130;248,Website design,opportunity,Quia voluptatem eos tenetur. Adipisci est animi. Aliquam dolor consectetur dignissimos incidunt officia. Quae qui ducimus. Nostrum eos ut expedita praesentium odio qui nostrum.,91300,2023-07-27T09:15:42.292Z,2023-09-08T15:58:12.509Z,2024-07-14T18:51:40.122Z,1,1,7
19,Ut magnam est,49,102;420,Website design,lost,"Animi dolore ducimus velit id. Voluptas aut reprehenderit non. Dolor pariatur nemo. Totam qui qui deserunt sed quae quos distinctio laboriosam ut.
 Quidem cum repellat ut doloremque rerum est ut. Aliquid ex totam beatae. Quod quidem cumque. Consequatur accusamus fuga numquam quasi. Eum quia alias corrupti illo et facilis magni itaque illum.",70700,2023-08-25T12:29:12.272Z,2024-02-15T23:31:04.685Z,2024-04-25T07:14:42.558Z,0,1,3
23,Optio aspernatur occaecati,39,123;187;253,Copywriting,won,"Natus quod incidunt. Qui sit officiis quisquam laudantium molestiae. Distinctio fuga non mollitia explicabo consequatur. Ducimus nostrum nemo vel repellendus.
 Velit nobis earum. Nulla harum dolor quis. Quam hic non culpa repudiandae modi aspernatur ut iusto omnis.
 Et in beatae quia numquam et labore omnis. Tempore et eligendi dolorem optio minima. Nesciunt aut voluptatem.",14000,2024-02-07T20:22:57.779Z,2024-02-16T14:43:28.083Z,2024-08-02T04:38:28.483Z,0,1,9
5,Sunt voluptatibus quo,4,64;498,Copywriting,delayed,"Nulla voluptatem omnis veritatis corrupti fugit tempora ad dolores nostrum. Reiciendis consequatur in. Dolorem omnis rerum voluptas soluta eum consequatur quas est nihil. Qui dolores delectus facere. Placeat deleniti unde. Sit sit deleniti perferendis fuga est eum consequatur et quibusdam.
 Amet aliquid aut corrupti dignissimos inventore et aperiam consequuntur iusto. Nobis placeat numquam sunt placeat qui assumenda recusandae. Est veniam inventore id veniam fugit aut quis. Velit similique at maxime nihil quo quia quo magni.",51000,2024-01-15T12:20:08.457Z,2024-02-12T05:22:57.897Z,2024-03-29T06:46:10.719Z,2,2,6
9,Ipsam magnam consequatur,18,45;483,UI Design,in-negociation,"Officiis laboriosam et mollitia a ut corporis distinctio quis. Consectetur excepturi vel minima ut necessitatibus nobis dolor. Et ducimus cumque odit at adipisci eveniet sed iure. Laboriosam asperiores tempore reprehenderit atque ad molestiae sequi. Sed ad impedit. Autem quis minus odit dolore exercitationem architecto doloremque.
 Aut aut et quia neque. Excepturi et nam et rem dolorem. Occaecati recusandae et praesentium.",20100,2023-11-29T10:09:12.121Z,2024-01-20T23:43:18.741Z,2024-07-19T07:48:46.112Z,3,2,5
10,Illo autem in,21,60;85;98,Website design,proposal-sent,"Non et similique possimus commodi et veritatis dolorem quo. Sed aliquid sint velit est nesciunt aut necessitatibus. Debitis eligendi ut delectus aut et. Cupiditate omnis molestiae.
 Nulla non aliquid ut nihil velit. Voluptatem ut quaerat distinctio consequatur praesentium commodi nihil. Repudiandae non dolor voluptatem odit.",4400,2023-08-13T13:33:30.522Z,2023-12-11T11:42:39.222Z,2024-07-20T02:41:53.484Z,0,2,6
13,Veniam modi magnam,16,120,UI Design,opportunity,"Aperiam laboriosam suscipit quia eligendi repellat voluptatem. Saepe asperiores sed sunt alias sunt eveniet incidunt ipsum eum. Voluptatum ut dolorem molestias dolores molestias. Illum architecto dolores doloremque corporis harum laborum quam eligendi. Omnis aut distinctio et deleniti.
 Optio sapiente quos doloremque. Consequatur veniam repellat dolor in distinctio accusantium eaque ut iste. Non suscipit aut aut odit. In nulla aliquid autem explicabo velit doloremque nulla libero pariatur. Velit dolor omnis. Ullam asperiores et sed iusto minus assumenda iure iure quae.",30800,2023-12-11T10:12:14.259Z,2024-01-22T21:56:21.969Z,2024-05-02T03:34:36.173Z,4,2,7
29,Qui repudiandae ipsa,35,459;467,UI Design,lost,"Maxime aspernatur quasi in et quibusdam nam et libero expedita. Rerum omnis sed minus aspernatur dicta aliquid non. Aut voluptates labore et soluta sint quia velit. Quam ut explicabo dolorem inventore voluptas earum ut facilis. Dolorum aperiam enim.
 Non non id. Dolorem numquam aut quasi. Expedita suscipit fugiat quos. Dolor hic odit. Blanditiis sed quaerat voluptatem molestiae aut autem sunt est quis.",22300,2022-08-13T05:44:20.204Z,2023-03-31T08:53:36.146Z,2024-08-01T03:13:46.230Z,1,2,4
34,Non itaque cumque,16,24;50;120,Print project,won,"Ipsam ab similique dolorum explicabo molestiae ab qui. Et blanditiis ut ad est asperiores. Nemo qui vero non non ut.
 Delectus omnis dignissimos enim numquam velit. Quo praesentium exercitationem consectetur mollitia nihil quos autem. Ipsam voluptatibus debitis laudantium at ea ratione ab aut. Aut aut voluptate sit voluptatum nostrum voluptatem modi. Consequatur qui non aliquid corporis velit at laudantium ut. Ut eligendi sapiente est ullam.
 Iste voluptas dolores in aspernatur. Sequi libero modi excepturi sed similique vero molestiae. Sapiente magnam quia perferendis rerum quod deleniti.",39500,2023-12-19T08:01:21.720Z,2024-01-24T02:46:40.133Z,2024-08-16T12:25:35.246Z,4,2,7
12,Sapiente rerum et,40,197,Print project,in-negociation,"Error error tempora. Esse ullam nostrum sed occaecati provident eum fugiat laboriosam sunt. Est perferendis et quod voluptas. Sunt non fuga voluptatum.
 Deleniti laudantium voluptatem corrupti officia minus unde quasi. Reiciendis inventore vel. Vero omnis aut sed cumque id vero et.
 Provident est distinctio dolor. Ipsa sed a enim est et iste. Officia et iste eos modi esse est ut quisquam rerum.",51200,2024-01-16T21:25:03.263Z,2024-02-08T22:05:24.283Z,2024-06-29T21:49:37.477Z,0,3,7
14,Qui fuga architecto,29,201,UI Design,opportunity,"Maiores ea eos inventore nam hic autem. Commodi similique sit et voluptas architecto. Molestias enim modi consequatur sed sed aut. Deleniti ad sed porro. Aspernatur officia inventore cupiditate.
 Et et laudantium dolorem nulla qui fugit dolore quia. Quo magnam quia dolor. Ipsum eius omnis dicta numquam. Quis cupiditate exercitationem. Est placeat iusto distinctio placeat totam. Modi voluptatem quod tempora id excepturi numquam impedit.
 Qui nobis quia et quidem natus. Laudantium et quaerat odit. Iusto sit a.",66400,2023-10-07T12:53:52.388Z,2023-11-09T10:42:54.222Z,2024-08-14T06:01:13.006Z,0,3,11
22,Excepturi voluptatem explicabo,32,191,UI Design,delayed,"Ipsam mollitia enim saepe. Dolores vero vel. Suscipit optio consequatur minima. Dolore omnis sunt neque nulla. Recusandae molestias quo.
 Illum blanditiis qui qui eveniet doloremque non eum voluptas voluptates. Repudiandae nemo aspernatur voluptates. Repellendus accusantium magni nostrum quo dolor facere laudantium ea. Reprehenderit officiis labore natus voluptatibus quisquam laudantium.
 Eos eveniet aut voluptatem ex et iure libero. Ut incidunt nisi deserunt. Facilis debitis ullam nesciunt totam. Nesciunt molestiae ex.
 Quibusdam labore quam porro doloribus. Magni quas eum sit. Quisquam voluptatem soluta. Est labore blanditiis iusto voluptatibus. Dolor ut maiores et. Et doloremque non.",70600,2024-01-17T13:11:43.736Z,2024-01-20T00:27:40.364Z,2024-06-04T10:53:58.975Z,0,3,6
24,Fuga voluptatem rerum,0,229,Print project,proposal-sent,"Architecto aut quia. Id sint vel consequatur iure voluptas in optio repudiandae itaque. Cumque nostrum distinctio.
 Itaque ut ratione enim magnam voluptatem modi. Explicabo nam iusto facilis repellendus. Vitae soluta ut quod ut dicta aut quibusdam facilis quia.
 Incidunt animi explicabo tempore incidunt praesentium reprehenderit pariatur. Tempora quaerat harum voluptates qui et. Dolor pariatur rerum labore.",78100,2023-03-10T11:09:02.603Z,2023-12-15T07:26:31.675Z,2024-06-04T01:13:08.851Z,0,3,3
37,Incidunt voluptate iure,15,44,Other,lost,"Ex iure vero. Nobis alias perspiciatis alias quisquam. Ducimus nulla nihil unde explicabo necessitatibus eius dolor et quidem. Ea quisquam quo occaecati. Ut alias nesciunt.
 Sint et atque quod repudiandae inventore et corporis ex. Animi adipisci suscipit neque et id cum perspiciatis molestiae. Consequatur voluptatem architecto est doloremque recusandae laudantium ut at deserunt. Voluptates consequatur omnis saepe nam nihil autem officia.",79600,2024-01-02T10:38:31.044Z,2024-01-24T06:18:48.139Z,2024-07-31T06:11:19.027Z,6,3,5
38,Qui dolorum porro,53,87,Other,won,"Est qui voluptatibus distinctio. Corporis sit eius et et consequatur accusamus. Maiores voluptatem asperiores neque atque atque et distinctio non.
 Veniam numquam et. Maxime voluptas soluta. Ipsam necessitatibus harum non vitae illo vel aut. Eveniet reiciendis est autem illum animi. Recusandae rem qui distinctio dolorem voluptas numquam ut consequatur. Aliquam consectetur et et voluptas animi.",29200,2024-01-14T01:57:04.335Z,2024-02-14T02:55:00.996Z,2024-07-31T04:56:10.947Z,0,3,4
16,Debitis nihil fuga,14,36,Copywriting,opportunity,"Iure consequatur omnis enim culpa quas ea. Saepe rerum ea debitis. Omnis qui impedit illum molestiae aspernatur ratione magnam rerum. Placeat dolor odio odit id sunt aut consequatur rem vitae.
 Vel saepe dolorem quidem tenetur voluptate excepturi velit. At maiores cupiditate velit harum dicta quas inventore. Excepturi eveniet labore dolorem et voluptatem molestiae tempore libero. Fugiat facilis blanditiis aperiam et exercitationem fugit magni dolores exercitationem.
 Quia excepturi ipsa quia. Doloribus magnam illum distinctio iusto. Eveniet nihil quia magni fugit maiores eius. Ipsum occaecati est unde maxime vel. Nihil at illo. Nobis harum eligendi tempora.
 Eaque provident et ipsum sit. Nam eum eos modi ipsum nihil. Voluptatum maiores repellendus repellat possimus qui. Distinctio fugiat quo culpa. Consequatur repudiandae in perferendis vel quaerat quis.",93300,2024-02-11T14:48:42.102Z,2024-02-16T18:50:55.142Z,2024-04-30T21:05:29.687Z,0,4,3
17,Fuga esse incidunt,38,18,Other,in-negociation,Hic sit et hic nemo beatae quo est odit. Placeat inventore omnis totam. Itaque laudantium autem minima voluptate earum. Inventore porro eaque deserunt.,21200,2021-10-12T13:12:17.331Z,2022-03-25T07:51:01.236Z,2024-07-25T23:03:37.700Z,5,4,7
25,Debitis sint est,4,64;227;251,Copywriting,delayed,Eum maiores dolorem explicabo minus provident ab. Qui aperiam sed et at. Fugit nobis nihil velit reprehenderit id veniam voluptas. Repudiandae ducimus autem molestias quibusdam iste. Praesentium porro asperiores ipsa. Sequi aut odit tempora temporibus magnam sit id cum.,81500,2023-11-30T03:58:36.464Z,2024-01-29T08:02:12.381Z,2024-05-17T08:25:53.445Z,2,4,4
35,Perferendis voluptas repellendus,10,270;295;312,Copywriting,proposal-sent,"Quas sunt numquam eligendi blanditiis. Ut dignissimos voluptatem deleniti quisquam incidunt sed. Quis dicta tenetur veritatis voluptatem facere a voluptatem quia. Ratione id ea earum nisi amet dignissimos.
 Dolor rem dolorem nihil. Reiciendis nihil ut qui distinctio nisi aperiam voluptatem voluptates. Voluptas molestiae voluptate alias mollitia. Dolor delectus ut.",84100,2024-01-25T15:05:47.154Z,2024-01-30T18:16:59.619Z,2024-04-30T13:11:46.218Z,0,4,2
40,Perferendis molestiae saepe,50,67;115;128,Other,won,"Qui maxime rerum dolores ratione exercitationem. Et odio molestiae voluptatem veritatis est in et aspernatur. Porro placeat eligendi non. Qui est sint.
 Maxime a vitae. Enim amet et illo quis reprehenderit animi eligendi. Animi nobis non est. Sed amet pariatur facilis et illo rerum.
 Fuga est qui iusto nam commodi nemo. Ut ut totam enim dolorum quia animi maiores. Rerum hic eos autem corporis saepe quasi sapiente. Expedita enim omnis error aut. Voluptatem voluptatem laboriosam expedita asperiores at consequatur vero pariatur fugit. Esse quasi excepturi aperiam libero sed molestias aut sit.
 Consequatur sed eligendi nostrum in et. Consequatur recusandae nobis odio laborum sapiente deserunt perspiciatis nulla velit. Optio at atque et incidunt autem excepturi dolorum aliquid qui.",35300,2024-01-04T07:22:54.166Z,2024-02-08T14:32:23.540Z,2024-07-23T05:50:12.289Z,10,4,6
18,Et delectus occaecati,38,177;183,UI Design,in-negociation,"Est rerum laborum eveniet inventore fugiat quod amet enim aut. Non numquam id consectetur reprehenderit accusantium. Quasi aut quas exercitationem fuga ipsa doloribus corporis est. Aperiam quia nam facilis asperiores sed cupiditate.
 Placeat nostrum expedita nostrum commodi. Ut nisi perferendis officiis deserunt ad earum ea. Fugit soluta ipsam qui. Fuga quae tempora quidem. Molestiae unde porro error iusto tempora aut hic libero totam.
 Ut quas fuga dolor dolorem voluptas assumenda ea pariatur id. Repudiandae nulla rerum magnam placeat. Quibusdam aut ducimus nihil nostrum magni dolorum dolorem fugiat. Aut reiciendis eaque labore et quia sapiente quia. Laboriosam quas nisi quo eum saepe maxime qui voluptatem. Consequatur sunt minima et veritatis.",44900,2022-06-11T13:37:35.418Z,2023-11-04T23:31:16.171Z,2024-07-31T02:22:55.009Z,5,5,7
26,Sed architecto ea,40,2;216;347,Print project,delayed,"Recusandae eligendi expedita odit doloribus voluptates suscipit ipsam rem est. Qui est aut iure voluptatem neque qui libero voluptatibus rerum. Et dolore qui vero excepturi excepturi quos reiciendis molestiae. In laudantium corrupti neque qui molestiae.
 Et aut dolor voluptas et accusantium autem dolores. Totam mollitia veritatis quis. Facere quisquam et tempora.",2100,2023-08-03T08:12:12.776Z,2023-11-29T19:32:01.029Z,2024-06-24T04:27:32.469Z,0,5,7
32,Dolorem nam eligendi,48,4;302;369,Copywriting,opportunity,"Accusamus architecto consequatur ratione omnis aliquid. Id repellendus tenetur ab laboriosam labore at est sint. Autem aut ipsum assumenda.
 Sunt eaque beatae. Eos laudantium sed rerum omnis ea non. Quibusdam ipsa perferendis. Quia deleniti nam eos unde quo neque iusto quia culpa. Aut illum non eum ut in odio id. Consequatur et omnis et.",15600,2021-04-28T12:15:06.106Z,2023-05-19T00:29:03.658Z,2024-06-11T15:04:54.784Z,5,5,7
39,Rerum amet quae,18,45;263,Website design,proposal-sent,"Maiores sapiente ratione quibusdam rerum ducimus. Enim aliquid voluptas quis exercitationem nihil et dolore impedit. Odit ratione perspiciatis facere labore est facilis unde. Est sapiente nesciunt esse nobis qui cupiditate.
 Nisi quia molestiae reprehenderit ea perferendis nihil eaque recusandae. Ut ex incidunt voluptatem aut officiis ipsam ipsam earum. Accusantium ut sunt sint aut ut perferendis pariatur temporibus. Cumque et facilis corporis nemo cupiditate rerum.
 Molestiae soluta aspernatur quae asperiores sunt odio. Sequi aut expedita a. Numquam neque facere dolores voluptas sequi explicabo accusantium quia.",50500,2022-05-22T14:13:25.621Z,2023-08-07T08:38:46.178Z,2024-03-27T06:47:33.279Z,3,5,7
42,Ea ut velit,50,115;128,Website design,won,"Sint est itaque est totam harum aut ad. Laborum est veniam ratione ab vel optio esse et. Ullam sequi ut illo. Necessitatibus velit ea a non dolorem quis quaerat. Vel unde assumenda ut facere voluptatem dicta eveniet omnis sit.
 Est doloremque dolorem minima et illo est illo laboriosam. Ut possimus nemo odio inventore quae. Ex et quo.",74700,2024-02-03T10:54:22.466Z,2024-02-17T00:38:30.767Z,2024-08-06T15:24:11.207Z,10,5,10
20,Ad sapiente quia,35,210;363;463,Copywriting,in-negociation,"In voluptatem velit dignissimos. Suscipit rerum modi. Repellat consectetur a minus fuga error doloremque doloremque dolor quibusdam. Commodi qui corporis magni necessitatibus quo officia quis nihil.
 Sunt voluptates nihil ut quaerat sit. Architecto eos veniam enim. Quia blanditiis voluptatem. Recusandae asperiores illum et veniam.
 Eos in consequuntur tempore aut eius esse et ullam. Doloremque adipisci ab. Unde et quod provident. Laboriosam aut aut voluptatem ipsa mollitia. Quibusdam accusamus at modi repellat in. Repellendus expedita nemo.
 Aut modi sint ut. Rem saepe laudantium nemo et et vitae sint. Nam iusto voluptatem ea consequuntur est animi facilis. Magni eveniet sit aut voluptas ut veniam et corporis magnam.",63400,2021-07-15T19:57:40.920Z,2023-10-04T03:44:07.717Z,2024-08-15T05:52:20.318Z,1,6,3
28,Est incidunt accusantium,36,150;399,Copywriting,delayed,"Voluptas nihil sunt atque maxime et occaecati eum. Earum earum voluptatem quidem adipisci aut cum. Amet asperiores sunt. Ut veritatis sed dolor non necessitatibus. Quis voluptatum dignissimos.
 Consequatur temporibus nisi. Doloribus minima recusandae aliquid. Aut ut eaque quae rerum ut ut doloribus.
 Quas dicta repellendus et soluta. Molestiae quis voluptas quo autem voluptatem qui sunt omnis. Qui sit dolores dolores quis quis velit vel modi. Ut eveniet facilis corporis nostrum blanditiis ex in. Repellendus eum deleniti est incidunt enim.
 Quis commodi ut architecto. Sequi eaque nulla et necessitatibus aut sapiente vel praesentium. Id facere architecto aliquid ab quia. Vel quisquam culpa est odio est vel dicta. Dolorem est ut et praesentium impedit qui. Voluptatibus reprehenderit ipsa quibusdam nostrum tempora.",99000,2023-12-16T16:34:13.016Z,2024-02-06T13:52:21.898Z,2024-08-16T11:40:41.591Z,1,6,5
36,Doloribus quo enim,54,282,Other,opportunity,"Nam error eveniet nesciunt. Officia saepe atque assumenda porro porro veritatis quis in quod. Quasi dolore explicabo esse non quis. Qui voluptatem ipsum aut aspernatur aliquid aut autem est ducimus. Modi similique corrupti earum corrupti molestiae sunt dolore dolorem.
 Quos modi voluptas eum facere rerum autem voluptates. Maiores velit nemo vel ad fugit. Magni voluptatem non nesciunt et molestiae excepturi ducimus ratione. Consequatur explicabo qui impedit iure ad in ea quasi praesentium.",66600,2021-05-17T07:43:40.550Z,2022-11-21T00:32:41.232Z,2024-06-09T15:12:56.852Z,9,6,5
43,Aut enim totam,38,18;183;192,Website design,proposal-sent,"Quia recusandae commodi nam voluptates eaque sunt. Accusantium dolorum odit temporibus labore debitis. Quibusdam reprehenderit id rerum doloribus modi.
 Alias consequatur occaecati ipsum dolore ab harum sequi minima. Omnis doloribus dolores quo sint facilis iusto. Quasi aperiam qui molestiae est doloribus ex repudiandae architecto eius. Rerum et laborum. Tempora itaque dolorem architecto non odit harum necessitatibus. Quia delectus in eius veritatis.
 Pariatur sunt earum enim. Odio quae molestiae corrupti est animi consequatur architecto dicta ab. Quibusdam facilis dolore earum ipsum voluptates cupiditate quas corrupti unde. Ad et dignissimos facilis id eius. Doloremque odio culpa excepturi. Rerum omnis sequi assumenda nihil fugit repellendus eligendi qui et.
 Illo repellendus ducimus quis et vel aut dolorem aspernatur. Qui voluptates doloribus enim et similique enim. Error exercitationem consequatur a impedit ea doloremque. Qui aperiam aut. Voluptate fugiat excepturi.",82700,2022-12-19T03:26:18.352Z,2024-02-13T22:34:52.520Z,2024-04-27T21:35:22.113Z,5,6,6
46,Consequuntur voluptas esse,0,205;351,Website design,won,"Dolorem et quia officiis repellendus. Omnis unde dolor et est cupiditate quam culpa ipsam. Porro consequatur quis aut dolor cumque.
 Ullam omnis commodi illo ullam. Molestiae maxime minima. Temporibus officiis qui est quis ipsum commodi esse error. Dolorem omnis repellendus reprehenderit error eum aliquid voluptas. Ut fugit unde placeat numquam.
 Nam assumenda sed repudiandae. Dignissimos dolorem eveniet. Accusamus excepturi vero. Deleniti iure eius.
 Accusantium consequuntur quis ut repellat aut similique perferendis omnis. Ut et molestiae vel id repudiandae quo magni. Unde omnis quo repellendus dolorum. Nisi quis illo ut quasi eos. Eos possimus temporibus. Est alias expedita sit est tempore officiis est et sint.",30600,2023-07-06T17:43:31.901Z,2023-11-17T04:49:56.657Z,2024-04-09T11:07:43.248Z,0,6,9
